{
  "type": "whiteboard.ops",
  "version": "1.0",
  "board": { "width": 1024, "height": 576, "unit": "px", "background": "#0b0f19" },
  "defaults": { "stroke": "#e6eaf2", "strokeWidth": 3, "fontFamily": "Inter", "fontSize": 26 },
  "ops": [
    { "op": "clear" },
    { "op": "add", "id": "ai1", "kind": "text", "props": { "x": 80, "y": 90, "text": "AI is driving the whiteboard âœ…", "color": "#60a5fa", "fontSize": 36, "fontWeight": 800 } },
    { "op": "add", "id": "ai2", "kind": "text", "props": { "x": 80, "y": 140, "text": "Next: model outputs ops JSON", "color": "#e6eaf2", "fontSize": 24, "fontWeight": 650 } }
  ]
}
