{
  "type": "whiteboard.ops",
  "version": "1.0",
  "board": { "width": 1024, "height": 576, "unit": "px", "background": "#0b0f19" },
  "defaults": { "stroke": "#e6eaf2", "strokeWidth": 3, "fontFamily": "Inter", "fontSize": 26 },
  "ops": [
    { "op": "add", "id": "t1", "kind": "text", "props": { "x": 80, "y": 60, "text": "Add Fractions", "fontSize": 36, "fontWeight": 700 } },
    { "op": "add", "id": "f1", "kind": "fraction_bar", "props": { "x": 80, "y": 120, "w": 520, "h": 70, "denominator": 6, "numerator": 3, "label": "1/2 = 3/6" } },
    { "op": "add", "id": "f2", "kind": "fraction_bar", "props": { "x": 80, "y": 220, "w": 520, "h": 70, "denominator": 6, "numerator": 1, "label": "1/6", "highlightColor": "rgba(0,200,140,0.3)" } }
  ]
}
